{
  "id": "17854360229135492",
  "caption": "Beautiful sunset at the beach! #photography",
  "media_type": "IMAGE",
  "media_url": "https://scontent.cdninstagram.com/media/example.jpg",
  "thumbnail_url": "https://www.instagram.com/p/example/",
  "permalink": "https://www.instagram.com/p/ABC123/",
  "shortcode": "ABC123",
  "timestamp": "2026-04-17T12:00:00+0000",
  "like_count": 250,
  "comments_count": 15
}